{
  "$schema": "https://json-schema.org/draft/2020-12/schema",
  "type": "object",
  "properties": {
    "schema_version": {
      "type": "number",
      "const": 2
    },
    "task_id": {
      "type": "string",
      "minLength": 1
    },
    "execution_id": {
      "type": "string",
      "minLength": 1
    },
    "outcome": {
      "type": "string",
      "enum": [
        "completed",
        "partial",
        "blocked",
        "no_supported_finding"
      ]
    },
    "summary": {
      "type": "string",
      "minLength": 1
    },
    "coverage": {
      "type": "array",
      "items": {
        "type": "string",
        "minLength": 1
      }
    },
    "gaps": {
      "type": "array",
      "items": {
        "type": "string",
        "minLength": 1
      }
    },
    "findings": {
      "type": "array",
      "items": {
        "type": "object",
        "properties": {
          "id": {
            "type": "string",
            "minLength": 1
          },
          "claim": {
            "type": "string",
            "minLength": 1
          },
          "evidence": {
            "type": "array",
            "items": {
              "type": "string"
            }
          },
          "caveats": {
            "type": "array",
            "items": {
              "type": "string",
              "minLength": 1
            }
          }
        },
        "required": [
          "id",
          "claim",
          "evidence",
          "caveats"
        ],
        "additionalProperties": false
      }
    },
    "changes": {
      "type": "array",
      "items": {
        "type": "object",
        "properties": {
          "path": {
            "type": "string",
            "minLength": 1
          },
          "description": {
            "type": "string",
            "minLength": 1
          }
        },
        "required": [
          "path",
          "description"
        ],
        "additionalProperties": false
      }
    },
    "checks": {
      "type": "array",
      "items": {
        "type": "object",
        "properties": {
          "id": {
            "type": "string",
            "minLength": 1
          },
          "status": {
            "type": "string",
            "enum": [
              "passed",
              "failed",
              "not_run"
            ]
          },
          "exit_code": {
            "type": [
              "number",
              "null"
            ]
          },
          "evidence": {
            "type": "array",
            "items": {
              "type": "string"
            }
          },
          "explanation": {
            "type": "string",
            "minLength": 1
          }
        },
        "required": [
          "id",
          "status",
          "exit_code",
          "evidence",
          "explanation"
        ],
        "additionalProperties": false
      }
    },
    "blockers": {
      "type": "array",
      "items": {
        "type": "string",
        "minLength": 1
      }
    },
    "next_action": {
      "type": "string",
      "minLength": 1
    }
  },
  "required": [
    "schema_version",
    "task_id",
    "execution_id",
    "outcome",
    "summary",
    "coverage",
    "gaps",
    "findings",
    "changes",
    "checks",
    "blockers",
    "next_action"
  ],
  "additionalProperties": false
}
