{"schema_version":2,"task_id":"task_b44b5086-3893-4938-babd-fd2526ef694e","execution_id":"exec_ad3e5441-417f-4b45-8195-176ad6f50bbb","outcome":"completed","summary":"Read input.txt which contains exactly 'violet'; the answer per the authoritative source is violet.","coverage":["input.txt (full contents read)"],"gaps":[],"findings":[{"id":"answer_violet","claim":"The answer reported by the authoritative source input.txt is violet.","evidence":["input.txt:1: violet"],"caveats":["Answer is based solely on the single-file source input.txt provided as the authoritative input; no other answer sources were consulted."]}],"changes":[],"checks":[{"id":"c1_read_input","status":"passed","exit_code":null,"evidence":["input.txt read; content is 'violet'"],"explanation":"The authoritative input file input.txt was read and contains exactly one line: 'violet'."},{"id":"c2_report_violet","status":"passed","exit_code":null,"evidence":["Answer cited against input.txt:1"],"explanation":"Acceptance criterion requires reporting violet citing input.txt, which is satisfied."}],"blockers":[],"next_action":"Parent review of the emitted result.json and summary.md; no further worker action required."}
