{
  "schema_version": 2,
  "task_id": "task_e5cd8bdf-8583-4a2b-8a0f-5a2d8359df92",
  "execution_id": "exec_58460b11-6dcf-4b37-a6b4-9c5da998da0d",
  "outcome": "completed",
  "summary": "The policy (policy.md:4) requires health checks to be authenticated by the service identity. The audit note (audit-note.md:3) classifies the /health route as a 'public route' and was observed without a signed session, but does not state whether service identity authentication was present (audit-note.md:4-5). The 'public route' classification contradicts the policy requirement for service identity authentication. The contradiction is not resolved within the supplied sources.",
  "coverage": [
    "policy.md:3",
    "policy.md:4",
    "audit-note.md:3",
    "audit-note.md:4-5",
    "review_scope.txt:1-2"
  ],
  "gaps": [
    "The audit note does not record whether service identity authentication was present for /health",
    "The term 'public route' in the audit note is not defined and appears to conflict with the policy's concept of service identity authentication",
    "The policy does not define what 'service identity' authentication entails",
    "The review scope prohibits inferring implementation behavior, so the actual implementation state of /health cannot be determined",
    "It is uncertain whether 'public route' means no authentication whatsoever or only exemption from user authorization with service authentication still required"
  ],
  "findings": [
    {
      "id": "F1",
      "claim": "All production routes require a signed session.",
      "evidence": [
        "policy.md:3 — 'All production routes require a signed session.'"
      ],
      "caveats": [
        "The policy does not define what constitutes a 'production route' or whether /health qualifies as one."
      ]
    },
    {
      "id": "F2",
      "claim": "Health checks are exempt from user authorization but must still be authenticated by the service identity.",
      "evidence": [
        "policy.md:4 — 'Health checks are exempt from user authorization but must still be authenticated by the service identity.'"
      ],
      "caveats": [
        "The policy does not define 'service identity' authentication."
      ]
    },
    {
      "id": "F3",
      "claim": "The /health route was observed without a signed session and was classified as an acceptable public route.",
      "evidence": [
        "audit-note.md:3 — 'The /health route was observed without a signed session and was classified as an acceptable public route.'"
      ],
      "caveats": [
        "The term 'public route' is not defined in the audit note. If it means no authentication at all, it contradicts F2."
      ]
    },
    {
      "id": "F4",
      "claim": "The audit note does not state whether service identity authentication was present.",
      "evidence": [
        "audit-note.md:4 — 'The note does not state whether service identity authentication was present.'"
      ],
      "caveats": [
        "Absence of recorded service identity authentication is not equivalent to its absence; the audit may not have checked for it."
      ]
    },
    {
      "id": "F5",
      "claim": "The policy requires service identity authentication for health checks, but the audit note classifies /health as a 'public route' without confirming service identity authentication, creating a contradiction.",
      "evidence": [
        "policy.md:4 — 'Health checks are exempt from user authorization but must still be authenticated by the service identity.'",
        "audit-note.md:3 — 'The /health route was observed without a signed session and was classified as an acceptable public route.'",
        "audit-note.md:4 — 'The note does not state whether service identity authentication was present.'"
      ],
      "caveats": [
        "The contradiction depends on interpreting 'public route' as implying no authentication whatsoever. If 'public route' means only exemption from user authorization with service identity authentication still required, the contradiction may not hold. The audit note does not clarify this.",
        "This contradiction is reported but not resolved per task instructions prohibiting silent source selection."
      ]
    }
  ],
  "changes": [
    {
      "path": "findings.md",
      "description": "Written as frozen evaluation deliverable in workspace containing indexed findings, contradiction analysis, coverage, gaps, and recommendation"
    },
    {
      "path": "/private/tmp/v2-eval-parent-20261012/policy-contradiction/state/reports/exec_58460b11-6dcf-4b37-a6b4-9c5da998da0d/summary.md",
      "description": "Assigned report output: readable summary with indexed findings, contradiction identification, source paths, coverage, uncertainty, and recommendation"
    },
    {
      "path": "/private/tmp/v2-eval-parent-20261012/policy-contradiction/state/reports/exec_58460b11-6dcf-4b37-a6b4-9c5da998da0d/result.json",
      "description": "Assigned report output: WorkerReport schema_v2 structured report"
    }
  ],
  "checks": [
    {
      "id": "summary-exists",
      "status": "not_run",
      "exit_code": null,
      "evidence": [
        "summary.md written to /private/tmp/v2-eval-parent-20261012/policy-contradiction/state/reports/exec_58460b11-6dcf-4b37-a6b4-9c5da998da0d/summary.md"
      ],
      "explanation": "Parent-only evaluator check (file_exists). Not run by worker; the parent runs the frozen evaluator. The required file has been created at the assigned report output path."
    },
    {
      "id": "coverage-recorded",
      "status": "not_run",
      "exit_code": null,
      "evidence": [
        "result.json includes coverage array referencing policy.md:3, policy.md:4, audit-note.md:3, audit-note.md:4-5, and review_scope.txt:1-2"
      ],
      "explanation": "Parent-only evaluator check (text_contains). Not run by worker; the parent runs the frozen evaluator. The coverage field in result.json contains the expected source path references."
    },
    {
      "id": "write-scope",
      "status": "not_run",
      "exit_code": null,
      "evidence": [
        "Only findings.md was written within the workspace. result.json and summary.md were written to the assigned report output path outside the workspace."
      ],
      "explanation": "Parent-only evaluator check (allowed_changed_paths). Not run by worker; the parent runs the frozen evaluator. The only workspace modification is findings.md, the declared allowed project write path."
    },
    {
      "id": "parent-qualitative-review",
      "status": "not_run",
      "exit_code": null,
      "evidence": [
        "Summary includes indexed findings (F1-F5), contradiction identification (F5), source paths for each claim, coverage mapping, uncertainty/gaps, and a recommendation. The contradiction is not resolved by silently choosing one source."
      ],
      "explanation": "Parent-only qualitative assessment. Not run by the worker; the parent runs the frozen evaluator. The summary.md report addresses all required qualitative elements."
    }
  ],
  "blockers": [],
  "next_action": "Escalate the contradiction to the policy owner. The policy requires service identity authentication for health checks, but the audit note classifies /health as a 'public route' without confirming service identity authentication. The audit note should be revised to either confirm service identity authentication compliance or explicitly flag the policy deviation. The policy should clarify the definition of 'service identity' authentication and whether 'public route' encompasses or excludes it."
}
