{
  "schema_version": 2,
  "task_id": "task_81eb284b-70fc-42d7-9952-db4f81e81daa",
  "execution_id": "exec_feddb112-707d-4b31-879f-a1e7430e395e",
  "outcome": "completed",
  "summary": "Read input.txt and confirmed its exact content is 'violet' on line 1. The answer required by the acceptance criteria ('Report violet citing input.txt') is satisfied. Both assigned report files written.",
  "coverage": [
    "input.txt (full file, single line) read via read tool",
    "Output contract result.json schema compliance verified manually"
  ],
  "gaps": [
    "No automated JSON schema validation was performed; schema conformance checked by manual inspection against the required field set."
  ],
  "findings": [
    {
      "id": "f1",
      "claim": "input.txt contains exactly the single line 'violet'.",
      "evidence": [
        "input.txt line 1 content: 'violet'"
      ],
      "caveats": [
        "File inspected contains exactly one line; no additional content beyond 'violet' was found.",
        "The file path inspected was /private/tmp/v2-live-campaign-20261012-01/live6/workspace/input.txt."
      ]
    }
  ],
  "changes": [],
  "checks": [],
  "blockers": [],
  "next_action": "No further action required; the answer 'violet' has been reported citing input.txt and both report files have been written."
}
