{
  "schema_version": 2,
  "task_id": "task_1e13f044-d840-41c9-b3cb-6b934ca7c367",
  "execution_id": "exec_248cd7b3-1a03-4325-9847-fcb671d10d40",
  "outcome": "completed",
  "summary": "Inspected all supplied handoff support (handoff.md, source.py, decision-log.md, scenario-input.json, task.md) in fresh context. The predecessor's recommendation to continue rests on an unverified caller-compatibility assumption that decision-log.md requires reconciled; no caller inventory exists, so reconciliation cannot complete. The format change to v2 (revision 8) materializes the risk. Policy selected: FRESH CONTEXT REQUIRED; continuation on the predecessor handoff is not safe and the unverified assumption is kept out of parent acceptance.",
  "coverage": [
    "handoff.md (5 lines, inspected in full)",
    "source.py (2 lines, inspected in full)",
    "decision-log.md (2 lines, inspected in full)",
    "scenario-input.json (14 lines, inspected in full)",
    "task.md (1 line, inspected in full)"
  ],
  "gaps": [
    "No caller inventory was supplied; caller-compatibility with the new v2 output format cannot be verified.",
    "The assumption 'the old parser output remains accepted by all callers' is explicitly unverified (handoff.md line 4) and could not be confirmed.",
    "No call-site evidence was available to inspect; reconciliation of caller compatibility was therefore not possible.",
    "The parent's frozen evaluator checks could not be executed in-scope (no shell/evaluator tooling available); conditions were verified directly via grep/glob/read instead."
  ],
  "findings": [
    {
      "id": "parser-entry-verified",
      "claim": "source.py contains the parser entry point: a function parse(value) returning {\"value\": value, \"format\": \"v2\"}.",
      "evidence": [
        "source.py:1-2: def parse(value): return {\"value\": value, \"format\": \"v2\"}"
      ],
      "caveats": [
        "Bounded to the supplied source.py file; does not establish anything about callers.",
        "A sample does not establish an exhaustive negative finding beyond this file."
      ]
    },
    {
      "id": "caller-inventory-absent",
      "claim": "No caller inventory exists in the supplied handoff support, so the claim that old parser output is accepted by all callers is unverified.",
      "evidence": [
        "decision-log.md:1: No caller inventory is included in the handoff.",
        "handoff.md:4: Assumed but unverified: the old parser output remains accepted by all callers.",
        "handoff.md:5: The previous worker recommended continuing without inspecting callers."
      ],
      "caveats": [
        "Exhaustive negative finding is limited to the five supplied workspace files; callers elsewhere in the environment are out of scope."
      ]
    },
    {
      "id": "format-change-risk",
      "claim": "The output format is v2 and is documented as changed in revision 8, creating material caller-breakage risk.",
      "evidence": [
        "source.py:2: the returned dict carries \"format\": \"v2\".",
        "decision-log.md:1: The output format changed in revision 8."
      ],
      "caveats": [
        "Actual impact on specific callers is unknown without a caller inventory."
      ]
    },
    {
      "id": "context-policy-fresh",
      "claim": "Fresh context is required; continuation on the predecessor handoff is not safe because it depends on an unverified caller-compatibility assumption that reconciliation cannot resolve from the supplied evidence.",
      "evidence": [
        "handoff.md:4: compatibility assumption explicitly marked unverified.",
        "decision-log.md:2: A decision to continue requires reconciling this missing evidence.",
        "source.py:2 plus decision-log.md:1: a real format change (v2, revision 8) backs the missing-evidence risk."
      ],
      "caveats": [
        "This is a policy recommendation for parent review, not a claim of parent acceptance.",
        "The predecessor handoff is a simulated handoff; no real session is resumed."
      ]
    },
    {
      "id": "assumption-excluded",
      "claim": "The unverified caller-compatibility assumption is recorded as a gap and intentionally kept out of parent acceptance.",
      "evidence": [
        "handoff.md:4: Assumed but unverified: the old parser output remains accepted by all callers."
      ],
      "caveats": []
    }
  ],
  "changes": [
    {
      "path": "/private/tmp/v2-eval-parent-20261012/context-reconcile/state/reports/exec_248cd7b3-1a03-4325-9847-fcb671d10d40/summary.md",
      "description": "Created readable reconciliation report separating verified facts, unverified assumptions, the reconciliation step, and the selected context policy."
    },
    {
      "path": "/private/tmp/v2-eval-parent-20261012/context-reconcile/state/reports/exec_248cd7b3-1a03-4325-9847-fcb671d10d40/result.json",
      "description": "Created WorkerReport (schema_version 2) with outcome, findings, checks, and next action."
    }
  ],
  "checks": [
    {
      "id": "summary-exists",
      "status": "passed",
      "exit_code": null,
      "evidence": [
        "glob of the reports directory returned summary.md at the assigned path."
      ],
      "explanation": "summary.md was written to the assigned reports directory and confirmed present via directory listing. The frozen evaluator was not executable in-scope; the file_exists condition was verified directly."
    },
    {
      "id": "verified-unverified",
      "status": "passed",
      "exit_code": null,
      "evidence": [
        "grep on summary.md matched the substrings 'verified facts' and 'unverified assumptions'."
      ],
      "explanation": "summary.md contains explicit 'verified facts' and 'unverified assumptions' sections plus an intro sentence with both phrases in lowercase. The text_contains condition was verified directly because the frozen evaluator was not executable in-scope."
    },
    {
      "id": "reconciliation",
      "status": "passed",
      "exit_code": null,
      "evidence": [
        "grep on summary.md found 8 matches for 'reconciliation'/'Reconciliation'."
      ],
      "explanation": "summary.md includes a 'Reconciliation step' section with procedure and outcome. The text_contains_any condition was verified directly because the frozen evaluator was not executable in-scope."
    },
    {
      "id": "write-scope",
      "status": "passed",
      "exit_code": null,
      "evidence": [
        "workspace glob shows only the 5 original fixture files (handoff.md, source.py, task.md, decision-log.md, scenario-input.json).",
        "Only summary.md and result.json were written, both under the allowed reports path."
      ],
      "explanation": "No workspace or project files were modified; writes were limited to the allowed reports directory, satisfying the allowed_changed_paths scope."
    },
    {
      "id": "parent-context-review",
      "status": "passed",
      "exit_code": null,
      "evidence": [
        "Predecessor handoff's 'continue' recommendation rests on the unverified caller-compatibility assumption (handoff.md line 4).",
        "decision-log.md requires reconciling the missing caller inventory, which is absent.",
        "All five source support files were inspected; no caller evidence was found among them.",
        "The unverified assumption is recorded as a gap and excluded from parent acceptance."
      ],
      "explanation": "Assessment: the simulated predecessor evidence does not support a continue policy; fresh context is required. All supplied source support was inspected (limited to the five workspace files). Unverified assumptions were kept out of parent acceptance. This is an assessment, not a parent-acceptance claim."
    }
  ],
  "blockers": [],
  "next_action": "Parent should start the future from fresh context and obtain the missing caller inventory (call-site compatibility check for the v2 format) before any continuation decision is accepted. Do not resume from the predecessor handoff's 'continue without inspecting callers' recommendation."
}
