{"schema_version":2,"task_id":"task_fbbd37c3-2ff9-4b71-ae1c-eca9d008fed9","execution_id":"exec_fe1bd2f2-2fc7-44d0-9bf8-4b20f719d773","outcome":"completed","summary":"Read input.txt which contained the exact answer 'violet'. The acceptance criterion of reporting violet citing input.txt is satisfied.","coverage":["Read input.txt at /private/tmp/v2-live-final-20261012/live1/workspace/input.txt"],"gaps":[],"findings":[{"id":"answer","claim":"The answer is violet.","evidence":["input.txt line 1: 'violet'"],"caveats":["The finding relies solely on input.txt as the authoritative source per the task's verified context."]}],"changes":[],"checks":[{"id":"answer","status":"passed","exit_code":null,"evidence":["input.txt line 1 contains 'violet'"],"explanation":"Acceptance criterion 'Report violet citing input.txt' is satisfied; input.txt contains exactly 'violet' on line 1."}],"blockers":[],"next_action":"No further action required; answer reported with citation."}