{"schema_version":2,"task_id":"task_b44b5086-3893-4938-babd-fd2526ef694d","execution_id":"exec_95030330-77cc-4f25-929a-f90d682bff85","outcome":"completed","summary":"Read correction.txt (superseding source) which contains exactly 'azure', and input.txt (superseded) which contains 'violet'. Per verified context correction.txt supersedes input.txt, so the current reported answer is azure.","coverage":["input.txt (full contents read)","correction.txt (full contents read)"],"gaps":[],"findings":[{"id":"answer_azure","claim":"The current authoritative answer, per the superseding source correction.txt, is azure.","evidence":["correction.txt:1: azure","input.txt:1: violet (superseded by correction.txt)"],"caveats":["Reported answer is azure per the superseding correction.txt; the previously-recorded input.txt answer violet is no longer authoritative for this execution but both files were preserved unmodified."]}],"changes":[],"checks":[{"id":"c1_read_sources","status":"passed","exit_code":null,"evidence":["input.txt read; content is 'violet'","correction.txt read; content is 'azure'"],"explanation":"Both input.txt and the superseding correction.txt were read in full."},{"id":"c2_report_azure","status":"passed","exit_code":null,"evidence":["Answer cited against correction.txt:1: azure"],"explanation":"Acceptance criterion requires reporting azure citing correction.txt, which is satisfied."}],"blockers":[],"next_action":"Parent review of the emitted result.json and summary.md; no further worker action required."}
