{"schema_version":2,"task_id":"task_d5d59e25-76aa-4447-9db8-9a59c2127f7f","execution_id":"exec_6aee666a-d052-4b1f-afd2-3bb47bad8039","outcome":"completed","summary":"Read input.txt in the workspace and confirmed the fixture answer is alpha. Wrote result.json and summary.md to the assigned report directory.","coverage":["input.txt"],"gaps":["Only input.txt was inspected; no other files examined for corroboration."],"findings":[{"id":"fixture-answer","claim":"The fixture answer is alpha.","evidence":["input.txt:1: The fixture answer is alpha."],"caveats":["Inspection limited to the single fixture file input.txt in the workspace."]}],"changes":[],"checks":[{"id":"inspect-input","status":"passed","exit_code":null,"evidence":["input.txt read successfully; content: 'The fixture answer is alpha.'"],"explanation":"Read input.txt and confirmed the fixture answer alpha."}],"blockers":[],"next_action":"Parent review of the reported finding; no further action required unless parent requests additional inspection."}